{
  "$schema": "https://json-schema.org/draft/2020-12/schema",
  "$id": "https://ashlar.dev/schemas/registry-index.schema.json",
  "title": "Ashlar Registry Index",
  "type": "object",
  "required": ["schemaVersion", "registry", "name", "version", "components"],
  "properties": {
    "$schema": {
      "type": "string"
    },
    "schemaVersion": {
      "const": "1.0"
    },
    "registry": {
      "type": "string"
    },
    "name": {
      "type": "string"
    },
    "version": {
      "type": "string"
    },
    "publishedAt": {
      "type": "string"
    },
    "components": {
      "type": "object",
      "additionalProperties": {
        "type": "object",
        "required": [
          "latest",
          "versions",
          "capsuleHashes",
          "tier",
          "layer",
          "stability",
          "description"
        ],
        "properties": {
          "latest": {
            "type": "string"
          },
          "versions": {
            "type": "array",
            "items": {
              "type": "string"
            }
          },
          "capsuleHashes": {
            "type": "object",
            "additionalProperties": {
              "type": "string",
              "pattern": "^sha256:[a-f0-9]{64}$"
            }
          },
          "tier": {
            "enum": ["foundation", "primitive", "composite", "pattern", "block"]
          },
          "layer": {
            "enum": [
              "markup-primitives",
              "interactive-components",
              "framework-adapters",
              "service-patterns",
              "application-blocks"
            ]
          },
          "stability": {
            "enum": ["proposal", "experimental", "beta", "stable", "deprecated"]
          },
          "description": {
            "type": "string"
          }
        },
        "additionalProperties": false
      }
    }
  },
  "additionalProperties": false
}
