{
  "$schema": "https://ashlar.dev/schemas/registry-index.schema.json",
  "schemaVersion": "1.0",
  "registry": "./registry",
  "name": "ashlar-local",
  "version": "0.0.1",
  "publishedAt": "2026-04-29T00:00:00.000Z",
  "components": {
    "alert": {
      "latest": "0.0.1",
      "versions": ["0.0.1"],
      "capsuleHashes": {
        "0.0.1": "sha256:37ac1c8fa68439d075691464c1af70707526cc49653a9052523960095d876f4f"
      },
      "tier": "primitive",
      "layer": "markup-primitives",
      "stability": "experimental",
      "description": "Semantic status message for public-service feedback and validation states."
    },
    "banner": {
      "latest": "0.0.3",
      "versions": ["0.0.1", "0.0.2", "0.0.3"],
      "capsuleHashes": {
        "0.0.1": "sha256:fabcb58bafe345b338aeaf82e1d2c57234ebd91e3688de838e8140a24fa79684",
        "0.0.2": "sha256:a2467888a6f483f43ca80131a7b69ee20337f6fdb84d9079836d18ddeba71b12",
        "0.0.3": "sha256:07e8b459ae2fab11f4a26ecc2f0a62ddb9acb178451d911433ee922a0bf4b0d7"
      },
      "tier": "primitive",
      "layer": "markup-primitives",
      "stability": "experimental",
      "description": "Official-site trust marker for federal and public-service pages."
    },
    "benefit-application": {
      "latest": "0.0.1",
      "versions": ["0.0.1"],
      "capsuleHashes": {
        "0.0.1": "sha256:37dea060ce85dfb8c4b4a7665c2f5655b0cdca9d93806c9aab65574cab656245"
      },
      "tier": "pattern",
      "layer": "service-patterns",
      "stability": "proposal",
      "description": "Small public-service application flow that composes the first Ashlar capsules."
    },
    "button": {
      "latest": "0.0.1",
      "versions": ["0.0.1"],
      "capsuleHashes": {
        "0.0.1": "sha256:8febe777cbedfb97bec3c1e1262b97a47105814a2f19d1e4eff4564667ff882e"
      },
      "tier": "primitive",
      "layer": "markup-primitives",
      "stability": "experimental",
      "description": "Accessible semantic action control for forms and workflows."
    },
    "checkbox": {
      "latest": "0.0.1",
      "versions": ["0.0.1"],
      "capsuleHashes": {
        "0.0.1": "sha256:918b7cb9a92f4dbf2fa49dc1fb8a6fb72c3c15cf914130f2d5d559a8aabc8b56"
      },
      "tier": "primitive",
      "layer": "markup-primitives",
      "stability": "experimental",
      "description": "Native checkbox control for consent, confirmation, and multi-select form questions."
    },
    "date-input": {
      "latest": "0.0.1",
      "versions": ["0.0.1"],
      "capsuleHashes": {
        "0.0.1": "sha256:f0a47e7847df4917b14468a511ee297378875feb033ce80e4f6818d3f714698d"
      },
      "tier": "primitive",
      "layer": "markup-primitives",
      "stability": "experimental",
      "description": "Native single-date input for simple public-service date questions."
    },
    "error-summary": {
      "latest": "0.0.1",
      "versions": ["0.0.1"],
      "capsuleHashes": {
        "0.0.1": "sha256:5334b0cfba9f10d89ac33942790ed9232fc29fd11d05e0d8f32663122da0a4ba"
      },
      "tier": "composite",
      "layer": "markup-primitives",
      "stability": "experimental",
      "description": "Linked validation summary that moves people directly to fields needing attention."
    },
    "form-field": {
      "latest": "0.0.1",
      "versions": ["0.0.1"],
      "capsuleHashes": {
        "0.0.1": "sha256:d808697310262ab0a0caf314a1f5dea5d11034cc3f5cf190bc9068ed50a32685"
      },
      "tier": "composite",
      "layer": "markup-primitives",
      "stability": "experimental",
      "description": "Accessible label, hint, error, and control wrapper for public-service forms."
    },
    "identifier": {
      "latest": "0.0.1",
      "versions": ["0.0.1"],
      "capsuleHashes": {
        "0.0.1": "sha256:7f01e708cfc2a1da85df4f250c2a48d51d8a029af4f4fca00d50b9c7747a76f1"
      },
      "tier": "primitive",
      "layer": "markup-primitives",
      "stability": "experimental",
      "description": "Required agency identifier and trust-link footer for federal public-service pages."
    },
    "radio-group": {
      "latest": "0.0.1",
      "versions": ["0.0.1"],
      "capsuleHashes": {
        "0.0.1": "sha256:f5bde22112129ae5bc551bc27bcb7cba314a46468c7109bc899079a09c0a6615"
      },
      "tier": "primitive",
      "layer": "markup-primitives",
      "stability": "experimental",
      "description": "Native radio group for mutually exclusive public-service form choices."
    },
    "select": {
      "latest": "0.0.1",
      "versions": ["0.0.1"],
      "capsuleHashes": {
        "0.0.1": "sha256:d5c41cd0930419f8dd185b66a33d95d5cdfe739dee2012f7ebfb0c3d1c514962"
      },
      "tier": "primitive",
      "layer": "markup-primitives",
      "stability": "experimental",
      "description": "Native select control for choosing one option from a bounded public-service list."
    },
    "text-input": {
      "latest": "0.0.1",
      "versions": ["0.0.1"],
      "capsuleHashes": {
        "0.0.1": "sha256:74c6e7efa8e6cb9e3ab1f72112e7bea66220adfa4813f21ebf86749a3267954c"
      },
      "tier": "primitive",
      "layer": "markup-primitives",
      "stability": "experimental",
      "description": "Semantic text entry control for forms that need labels, hints, and errors."
    },
    "textarea": {
      "latest": "0.0.1",
      "versions": ["0.0.1"],
      "capsuleHashes": {
        "0.0.1": "sha256:19df738db6d5a35de218eb4dc7fdb77e96361308b4c80f4b86053979a3f16cf7"
      },
      "tier": "primitive",
      "layer": "markup-primitives",
      "stability": "experimental",
      "description": "Native multiline text control for public-service long-answer fields."
    }
  }
}
